105,support vector machine,medical imaging,Classification of Medical Text Data Using Convolutional Neural Network-Support Vector Machine Method,https://www.ingentaconnect.com/contentone/asp/jmihi/2020/00000010/00000007/art00039,3,2020,,,,,,
106,support vector machine,phylogenetics,Rapid identification and quality evaluation of medicinal centipedes in China using near-infrared spectroscopy integrated with support vector machine …,https://www.hindawi.com/journals/jspec/2019/9636823/abs/,3,2019,,,,,,
107,support vector machine,biodiversity,Biodiversity estimation by environment drivers using machine/deep learning for ecological management,https://www.sciencedirect.com/science/article/pii/S1574954123003485,3,2023,,,,,,
108,support vector machine,immunology,… and classifiers for various subtypes of HTLV-1-caused ATLL cancer identified by a combination of differential gene co‑expression and support vector machine …,https://link.springer.com/article/10.1007/s00430-023-00767-8,3,2023,,,,,,
109,support vector machine,developmental biology,Disrupted dynamic amplitude of low-frequency fluctuations in patients with active thyroid-associated ophthalmopathy,https://www.frontiersin.org/articles/10.3389/fcell.2023.1174688/full,3,2023,,,,,,
110,support vector machine,disease ecology,"A landscape epidemiological approach for predicting chronic wasting disease: a case study in Virginia, US",https://www.frontiersin.org/articles/10.3389/fvets.2021.698767/full,3,2021,,,,,,
111,support vector machine,disease ecology,Automated chagas disease vectors identification using data mining techniques,https://ieeexplore.ieee.org/abstract/document/9208261/,3,2020,,,,,,
112,support vector machine,disease ecology,Using machine learning models to predict the effects of seasonal fluxes on Plesiomonas shigelloides population density,https://www.sciencedirect.com/science/article/pii/S0269749122019480,3,2023,,,,,,
113,support vector machine,paleontology,Accurate automatic classification system for 3D CT images of some vertebrate remains from Egypt,https://www.tandfonline.com/doi/abs/10.1080/16583655.2022.2096391,2,2022,,,,,,
114,support vector machine,paleontology,Comparison between Machine Learning and Physical Models Applied to the Evaluation of Co-Seismic Landslide Hazard,https://www.mdpi.com/2076-3417/13/14/8285,2,2023,,,,,,
115,support vector machine,paleontology,Incorporating machine learning with Raman spectroscopy to differentiate bone types,https://www.spiedigitallibrary.org/conference-proceedings-of-spie/11252/1125217/Incorporating-machine-learning-with-Raman-spectroscopy-to-differentiate-bone-types/10.1117/12.2546463.short,2,2020,,,,,,
116,support vector machine,systems biology,Biomarker discovery from high-throughput data by connected network-constrained support vector machine,https://www.sciencedirect.com/science/article/pii/S0957417423006814,2,2023,,,,,,
117,support vector machine,bioinformatics,Recognition of Protein Network for Bioinformatics Knowledge Analysis Using Support Vector Machine,https://www.hindawi.com/journals/bmri/2022/2273648/,2,2022,,,,,,
118,support vector machine,marine biology,Machine learning algorithms accurately identify free-living marine nematode species,https://peerj.com/articles/16216/,2,2023,,,,,,
119,support vector machine,phylogenetics,Machine learning can be as good as maximum likelihood when reconstructing phylogenetic trees and determining the best evolutionary model on four taxon …,https://www.biorxiv.org/content/10.1101/2023.07.12.548770.abstract,2,2023,,,,,,
120,support vector machine,phylogenetics,Deep learning based phylogenetic analysis,https://ieeexplore.ieee.org/abstract/document/9219386/,2,2020,,,,,,
121,support vector machine,biogeography,Biogeography-based optimization and support vector regression for freeway travel time prediction and feature selection,https://arxiv.org/abs/2007.15212,2,2020,,,,,,
122,support vector machine,disease ecology,Multi-scale remote sensing-based landscape epidemiology of the spread of rapid 'Ōhiʻa Death in Hawaiʻi,https://www.sciencedirect.com/science/article/pii/S0378112723002177,2,2023,,,,,,
123,support vector machine,disease ecology,Modeling species geographic distributions in aquatic ecosystems using a density-based clustering algorithm,https://vtechworks.lib.vt.edu/items/72bff057-850a-4bb4-8258-246c0a22b9a2,2,2022,,,,,,
124,support vector machine,ecology,"… of the water-energy-food-ecology nexus in the Yangtze River Economic Belt based on TOPSIS, neighborhood rough set and support vector machine",https://www.frontiersin.org/articles/10.3389/fenvs.2022.944075/full,2,2022,,,,,,
125,support vector machine,metabolomics,SVM-based analysis of NMR spectra in metabolomics: development of procedures,https://www.josam.org/josam/article/view/26,2,2019,,,,,,
126,support vector machine,environmental biology,A MACHINE LEARNING MODEL FOR BREAST CANCER DETECTION USING SUPPORT VECTOR MACHINE,https://www.researchgate.net/profile/Imran-Qureshi-20/publication/378157924_A_MACHINE_LEARNING_MODEL_FOR_BREAST_CANCER_DETECTION_USING_SUPPORT_VECTOR_MACHINE/links/65cb41f334bbff5ba70c5186/A-MACHINE-LEARNING-MODEL-FOR-BREAST-CANCER-DETECTION-USING-SUPPORT-VECTOR-MACHINE.pdf,1,2022,,,,,,
127,support vector machine,paleontology,"Practical Research on Artificial Intelligence Algorithms, Paleontology, Data Mining, and Digital Restoration of Public Information",https://www.hindawi.com/journals/cin/2022/3068686/,1,2022,,,,,,
128,support vector machine,paleontology,AI in Paleontology,https://www.biorxiv.org/content/10.1101/2023.08.07.552217.abstract,1,2023,,,,,,
129,support vector machine,marine biology,HRFSVM: Identification of fish disease using hybrid Random Forest and Support Vector Machine,https://link.springer.com/article/10.1007/s10661-023-11472-7,1,2023,,,,,,
130,support vector machine,phylogenomics,Unsupervised Learning in Phylogenomic Analysis over the Space of Phylogenetic Trees,https://uknowledge.uky.edu/statistics_etds/39/,1,2019,,,,,,
131,support vector machine,phylogenomics,Tropical data science,https://arxiv.org/abs/2005.06586,1,2020,,,,,,
132,support vector machine,microbiology,An Enhanced Method for Diagnosis of Bacterial Vaginosis based on Support Vector Machines with Linear Kernel.,https://search.ebscohost.com/login.aspx?direct=true&profile=ehost&scope=site&authtype=crawler&jrnl=20071558&AN=152879399&h=K55x5WykLpTmmgOUtmWqiAc%2FLOPCLI2bYqngRWQqeRo8eUEQj2G%2Buwvk3yRx6IlLnbaolO5ghsp0LJK9IWRNYg%3D%3D&crl=c,1,2021,,,,,,
133,support vector machine,disease ecology,Machine Learning in Neuromuscular Disease Classification,https://link.springer.com/content/pdf/10.1007/978-981-19-1550-5_56-1.pdf,1,2022,,,,,,
134,support vector machine,disease ecology,Predictive modeling of epidemic diseases based on vector-borne diseases using artificial intelligence techniques,https://www.taylorfrancis.com/chapters/edit/10.1201/9781003309451-5/predictive-modeling-epidemic-diseases-based-vector-borne-diseases-using-artificial-intelligence-techniques-inderpreet-kaur-yogesh-kumar-amanpreet-kaur-sandhu-muhammad-fazal-ijaz,1,2023,,,,,,
135,support vector machine,disease ecology,Deep learning for plant bioinformatics: an explainable gradient-based approach for disease detection,https://www.frontiersin.org/journals/plant-science/articles/10.3389/fpls.2023.1283235,1,2023,,,,,,
,,,,,,,,,,,,

